{"description":{"plain":"Security suite, contract_only mode carrying a numeric price — REVERSED 2026-10-05 per resolved maintainer guidance: contract_only is a genuinely unpriced state (the unresolved response to a caller who has not established entitlement); an entitled caller's resolved price transitions to buyer_specific + price instead. This fixture now demonstrates the REJECTED shape: contract_only + price MUST be invalid."},"id":"var_sec_suite_contract_priced","price":{"amount":62500,"currency":"USD"},"pricing":{"mode":"contract_only"},"title":"Security Suite"}
