{"id":"var_industrial_printer","title":"Industrial Printer","description":{"plain":"Leased on quoted terms."},"pricing":{"mode":"quote_required"},"unit_price":{"amount":500,"currency":"USD","measure":{"unit":"ml","display_text":"ml","value":750},"reference":{"unit":"ml","display_text":"ml","value":100}}}
