{"description":{"plain":"MUST stay invalid: price is UCP's ordinary selling/current-purchase price; quote_required says no such usable price has been resolved. Allowing both would force Platforms to guess whether the numeric price is indicative/starting-at/list/stale/estimated/actually-purchasable. If a Business wants a reference value while a quote is required, it should use list_price (already exists) or a future explicitly-defined indicative-price construct — never overload price."},"id":"var_sec_suite","price":{"amount":49900,"currency":"USD"},"pricing":{"mode":"quote_required","next_step":"request_quote"},"title":"Security Suite"}
