{"availability":{"available":true},"description":{"plain":"Size 10 variant"},"id":"var_blue_runner_10","options":[{"label":"10","name":"Size"}],"price":{"amount":12000,"currency":"USD"},"seller":{"links":[{"type":"refund_policy","url":"https://business.example.com/refunds"}],"name":"Example Store"},"sku":"BRP-BLU-10","tags":["running","road","neutral"],"title":"Size 10"}
